{
  "$schema": "https://json-schema.org/draft/2020-12/schema",
  "$id": "https://lull-community.invalid/schemas/release.schema.json",
  "title": "Lull Community Release Manifest",
  "description": "release/release.json 的格式。schemaVersion 1 是只有批次签名的旧格式；schemaVersion 2 为每个 item 增加 signature 指针，指向 release/signatures/ 下的逐包签名文件。",
  "type": "object",
  "additionalProperties": false,
  "required": ["schemaVersion", "releaseSeq", "generatedAt", "signedBy", "repo", "counts", "items"],
  "properties": {
    "schemaVersion": {
      "enum": [1, 2]
    },
    "releaseSeq": {
      "type": "integer",
      "minimum": 1
    },
    "generatedAt": {
      "type": "string",
      "pattern": "^\\d{4}-\\d{2}-\\d{2}T\\d{2}:\\d{2}:\\d{2}(?:\\.\\d+)?Z$"
    },
    "signedBy": {
      "$ref": "#/$defs/signedBy"
    },
    "repo": {
      "type": "object",
      "additionalProperties": false,
      "required": ["url", "builtFrom"],
      "properties": {
        "url": { "type": "string", "minLength": 1 },
        "builtFrom": { "type": "string" }
      }
    },
    "counts": {
      "type": "object",
      "additionalProperties": false,
      "required": ["scenes", "widgets"],
      "properties": {
        "scenes": { "type": "integer", "minimum": 0 },
        "widgets": { "type": "integer", "minimum": 0 }
      }
    },
    "items": {
      "type": "array",
      "items": { "$ref": "#/$defs/item" }
    }
  },
  "allOf": [
    {
      "if": {
        "properties": { "schemaVersion": { "const": 2 } },
        "required": ["schemaVersion"]
      },
      "then": {
        "properties": {
          "items": {
            "items": { "required": ["signature"] }
          }
        }
      }
    }
  ],
  "$defs": {
    "signedBy": {
      "type": "object",
      "additionalProperties": false,
      "required": ["keyId", "algorithm"],
      "properties": {
        "keyId": { "type": "string", "pattern": "^[0-9a-f]{16}$" },
        "algorithm": { "const": "ed25519" }
      }
    },
    "zip": {
      "type": "object",
      "additionalProperties": false,
      "required": ["path", "sha256", "bytes"],
      "properties": {
        "path": { "type": "string", "pattern": "^/downloads/[^\\\\]+$" },
        "sha256": { "type": "string", "pattern": "^[0-9a-f]{64}$" },
        "bytes": { "type": "integer", "minimum": 0 }
      }
    },
    "signature": {
      "type": "object",
      "additionalProperties": false,
      "required": ["path", "sha256"],
      "properties": {
        "path": {
          "type": "string",
          "pattern": "^/release/signatures/(scene|widget)/[^\\\\]+\\.lull-signature\\.json$"
        },
        "sha256": { "type": "string", "pattern": "^[0-9a-f]{64}$" }
      }
    },
    "item": {
      "type": "object",
      "additionalProperties": false,
      "required": ["kind", "slug", "id", "version", "digest", "zip"],
      "properties": {
        "kind": { "enum": ["scene", "widget"] },
        "slug": { "type": "string", "minLength": 1 },
        "id": { "type": "string", "minLength": 1 },
        "version": { "type": "string", "minLength": 1 },
        "digest": { "type": "string", "pattern": "^[0-9a-f]{64}$" },
        "zip": { "$ref": "#/$defs/zip" },
        "signature": { "$ref": "#/$defs/signature" }
      }
    }
  }
}
