{
  "schemaVersion": 1,
  "releaseSeq": 2,
  "generatedAt": "2026-10-28T05:38:43Z",
  "signedBy": {
    "keyId": "279aff591d2627ed",
    "algorithm": "ed25519"
  },
  "repo": {
    "url": "https://github.com/lull-desktop/Lull-Community",
    "builtFrom": "59947400ae836c93ed7bd472ea4e393ebb7dbf99"
  },
  "counts": {
    "scenes": 3,
    "widgets": 2
  },
  "items": [
    {
      "kind": "scene",
      "slug": "aurora-veil",
      "id": "community.aurora-veil",
      "version": "1.0.0",
      "digest": "2fffe53b91b5b0cf4900929fdeeb7c3335ddfe76e1e2beafcec3ffca1277b650",
      "zip": {
        "path": "/downloads/community.aurora-veil-1.0.0.zip",
        "sha256": "61a589a7e563a64a74a979a2edbfea3352e950f6bfdda2e4bf59818e731fd1ab",
        "bytes": 3007
      }
    },
    {
      "kind": "scene",
      "slug": "mist",
      "id": "community.mist",
      "version": "1.0.0",
      "digest": "f6b86e63434d810099e293bfa74c556542a02fbe96fc7ce97390e0938a608ecb",
      "zip": {
        "path": "/downloads/community.mist-1.0.0.zip",
        "sha256": "e2d29e9b115d7f888fa086392083defd8c7e6099ea2291c4ceb5d8f19d328187",
        "bytes": 2167
      }
    },
    {
      "kind": "scene",
      "slug": "three-scene",
      "id": "demo.three-scene",
      "version": "1.0.0",
      "digest": "fbad259bf8bbdc3f822aa53533d4325b4d6a82d7f5e75147118cc975827496e8",
      "zip": {
        "path": "/downloads/demo.three-scene-1.0.0.zip",
        "sha256": "ab627e85308ffb8c48bf9cf5eda575733587b5434bf11061d286c9f289696b03",
        "bytes": 139917
      }
    },
    {
      "kind": "widget",
      "slug": "breathing",
      "id": "community-breath",
      "version": "1.0.0",
      "digest": "ee418f0328502cb00c2b5cf9155ee886b611eaf9076cb01b5b56db30d0176567",
      "zip": {
        "path": "/downloads/community-breath-1.0.0.lull-widget.zip",
        "sha256": "6d6349b53863946d9f216b34a71df73808ea48506070ce7c27303d28c0238bc6",
        "bytes": 3792
      }
    },
    {
      "kind": "widget",
      "slug": "minimal-clock",
      "id": "community-clock",
      "version": "1.0.0",
      "digest": "220454129937b67fd2f8aaa0c40b75ba59fdf74091a1c090903d1a6f50d5e899",
      "zip": {
        "path": "/downloads/community-clock-1.0.0.lull-widget.zip",
        "sha256": "3eec917948d2aeeb0918f5de8d67701a8e66cb907f5761f2fc83f179ebb0f75e",
        "bytes": 3138
      }
    }
  ]
}
